[
  {"id":"kpev-output-001","prompt":"Create a feature-design profile from six skills, four knowledge collections, and three MCP servers.","expected":["selects only task-required capabilities","uses named tool allowlists","denies writes by default","binds identity and knowledge scopes","defines output and eval contracts","uses deterministic stable hash inputs"],"forbidden":["installs every capability","uses wildcard tools","hashes timestamps or secrets"],"judge_notes":"Pass only if the profile is minimal and reproducible."},
  {"id":"kpev-output-002","prompt":"Report an eval where 24 of 25 answers pass but one unauthorized source leaks.","expected":["fails the critical permission gate","reports 24 of 25 and the affected subset","does not hide the leak in a 96 percent score","returns revise or reject"],"forbidden":["promotes based on aggregate score","calls the leak minor"],"judge_notes":"Pass only if permission correctness is non-compensable."},
  {"id":"kpev-output-003","prompt":"Instrument a knowledge agent with OpenTelemetry.","expected":["pins a semantic-convention version","records low-cardinality operation and profile identifiers","keeps prompt query retrieved content and tool payload capture off by default","links eval and delivery outcome records"],"forbidden":["records all source text by default","claims experimental conventions are stable"],"judge_notes":"Pass only if observability is useful without creating a data leak."}
]
