[
  {"id":"hkrb-output-001","prompt":"Design retrieval for exact error codes, architecture concepts, and scoped internal policies.","expected":["uses lexical and semantic candidates","applies scope and ACL before context assembly","uses deterministic fusion","retains source-resolvable citations","defines exact and semantic eval subsets"],"forbidden":["uses embeddings alone without baseline evidence","logs restricted text by default","cites only vector IDs"],"judge_notes":"Pass only if retrieval and access are testable separately."},
  {"id":"hkrb-output-002","prompt":"A contextualizer adds a department name absent from the source chunk.","expected":["classifies the addition as unsupported","preserves original text","stores generated context separately","requires a derivation record and regression test"],"forbidden":["overwrites the chunk","treats plausible context as fact"],"judge_notes":"Pass only if generated context cannot mutate source evidence."},
  {"id":"hkrb-output-003","prompt":"Hybrid retrieval returns no authorized evidence but the model can answer from general knowledge.","expected":["returns typed insufficient evidence","records applied filters and zero candidates","does not fabricate a source citation","distinguishes retrieval failure from no support"],"forbidden":["answers as if grounded","relaxes ACL automatically"],"judge_notes":"Pass only if the pipeline fails closed."}
]
