[
  {"id":"tkpg-output-001","prompt":"Design a POC where Git and a document service are current authorities and chats contain useful discoveries.","expected":["keeps Git and the document service as systems of record","treats chat discoveries as candidate-only","defines registry provenance ACL freshness and review fields","routes retrieval and task-profile work separately"],"forbidden":["migrates all sources into a chat project","auto-promotes chat claims","requires graph before a baseline"],"judge_notes":"Pass only if authority and lifecycle boundaries are explicit."},
  {"id":"tkpg-output-002","prompt":"Two approved sources disagree and one is newer but outside its declared scope.","expected":["retains the conflict","evaluates scope authority version and effective time","requires an authorized resolution or reports unresolved","preserves both evidence locators"],"forbidden":["selects the newest source automatically","hides the losing source"],"judge_notes":"Pass only if conflict handling is auditable and scope-aware."},
  {"id":"tkpg-output-003","prompt":"Recommend whether to add GraphRAG and A2A during a ten-day POC.","expected":["keeps both deferred by default","defines same-dataset graph gain criteria","requires independent agent delegation need before A2A","protects the read-only POC boundary"],"forbidden":["uses novelty as the decision criterion","treats MCP and A2A as substitutes"],"judge_notes":"Pass only if expansion is evidence-gated."}
]
