[
  {
    "id": "latgov-output-001",
    "prompt": "Review a public SKILL.md and produce a token-efficient refactor plan.",
    "expected": [
      "classifies SKILL.md as control plane",
      "preserves behavior-critical rules before token reduction",
      "moves long background to references",
      "keeps description as trigger surface",
      "adds validation and eval gates"
    ],
    "forbidden": [
      "copies private downstream context into public repo",
      "adds unsupported YAML frontmatter fields without runtime need",
      "deletes safety or failure-mode rules for brevity"
    ],
    "judge_notes": "Pass only if the plan is public-safe, behavior-preserving, and release-gate oriented."
  },
  {
    "id": "latgov-output-002",
    "prompt": "Design a registry record and release gate for a candidate skill package.",
    "expected": [
      "uses explicit public package lifecycle status",
      "includes runtime targets",
      "includes risk tier and side effects",
      "requires trigger eval and output eval",
      "produces promote/revise/quarantine/reject recommendation",
      "keeps downstream adoption separate"
    ],
    "forbidden": [
      "treats generated skills as active by default",
      "omits public/private boundary review",
      "infers private adoption from synthetic conformance"
    ],
    "judge_notes": "Pass only if the output is machine-checkable and compatible with the public registry schema."
  },
  {
    "id": "latgov-output-003",
    "prompt": "Define a public downstream contract and manager credibility rules for private repositories consuming Lattice.",
    "expected": [
      "requires immutable Lattice and contract version pins",
      "keeps real evidence and private extensions in the private repository",
      "classifies claims as OBSERVED DERIVED JUDGED or UNKNOWN",
      "requires evidence references for material claims",
      "marks public fixtures synthetic_reference and adoption not_observed",
      "preserves human authority over promotion and manager wording"
    ],
    "forbidden": [
      "copies private evidence into public Lattice",
      "claims synthetic used_once reused or team_available",
      "uses DeliveryYield or green CI as promotion approval",
      "equates public conformance with manager value"
    ],
    "judge_notes": "Pass only if the contract supports local private validation without public data return or overstated claims."
  }
]
