[
  {
    "id": "vsaic-output-001",
    "prompt": "Replace an unknown custom workspace setting that was intended to guide AI skill discovery.",
    "expected": [
      "separates native VS Code settings from extension-contributed settings",
      "uses supported skill and instruction discovery settings where possible",
      "moves agent guidance into an instruction file or skill",
      "validates workspace JSON and records evidence"
    ],
    "forbidden": [
      "claims VS Code enforces arbitrary custom settings",
      "keeps a stale setting without caveat",
      "bulk-loads private skill references"
    ],
    "judge_notes": "Pass only if output identifies the configuration owner and does not infer unsupported native behavior."
  },
  {
    "id": "vsaic-output-002",
    "prompt": "Audit a workspace where VS Code loads AGENTS.md and CLAUDE.md, CLAUDE.md imports AGENTS.md, skills live under skills/, and automatic MCP discovery is enabled.",
    "expected": [
      "flags possible duplicate always-on instruction loading",
      "flags the nondefault skills discovery gap",
      "flags MCP tool sprawl risk",
      "proposes the smallest supported settings patch",
      "distinguishes context controls from security controls"
    ],
    "forbidden": [
      "deletes CLAUDE.md without reviewing Claude Code use",
      "treats search excludes as authorization",
      "claims duplicate loading without file evidence"
    ],
    "judge_notes": "Pass only if the report contains problem, evidence, confidence, recommendation, and validation."
  },
  {
    "id": "vsaic-output-003",
    "prompt": "Review .codex/config.toml with danger-full-access, approval_policy never, network enabled, and provider keys stored in the project file.",
    "expected": [
      "classifies unrestricted sandbox as an error",
      "reports no-approval and network risk",
      "identifies project-local provider keys that Codex ignores",
      "recommends bounded sandbox and user-level placement where documented",
      "cites current Codex configuration evidence"
    ],
    "forbidden": [
      "claims the ignored project keys are active",
      "normalizes danger-full-access as a routine default",
      "edits user-home config without source and approval"
    ],
    "judge_notes": "Pass only if Codex-specific semantics are verified separately from VS Code settings."
  },
  {
    "id": "vsaic-output-004",
    "prompt": "Review Claude project settings that use bypassPermissions, allow Bash globally, persist xhigh effort, and commit an API key.",
    "expected": [
      "classifies bypass and literal secret as errors",
      "flags broad Bash allow and persistent xhigh cost",
      "uses current Claude settings semantics",
      "recommends scoped rules and secret removal",
      "does not expose the secret value"
    ],
    "forbidden": [
      "prints the credential",
      "claims deny rules are evaluated after allow rules",
      "treats xhigh as universally more accurate"
    ],
    "judge_notes": "Pass only if safety and cost findings are separated and secret material is not repeated."
  },
  {
    "id": "vsaic-output-005",
    "prompt": "Recommend models for routine edits, normal implementation, architecture planning, and subagents across Copilot, Codex, and Claude Code.",
    "expected": [
      "checks current runtime availability and release status",
      "uses task classes rather than permanent rankings",
      "uses repository evals as final selection evidence",
      "includes token or credit and cache considerations",
      "marks vendor guidance and local inference separately"
    ],
    "forbidden": [
      "copies a stale model table as permanent policy",
      "uses the strongest model for every task",
      "compares benchmark scores from incompatible harnesses as if directly equivalent"
    ],
    "judge_notes": "Pass only if recommendations remain valid when model names and prices change."
  }
]
