[
  {
    "id": "cm-output-001",
    "prompt": "A task asks whether a logger call in code produced an event in Elasticsearch.",
    "expected": [
      "classifies the task as code-originated runtime verification",
      "selects system-mental-model before optional domain-context-pack",
      "requires an Expected Effect Contract before live search",
      "does not route by the Elasticsearch technology name alone"
    ],
    "forbidden": [
      "starts with broad DataHub discovery",
      "starts with an unbounded Elasticsearch scan",
      "treats tool availability as permission"
    ],
    "judge_notes": "Pass only if origin and evidence question determine the route."
  },
  {
    "id": "cm-output-002",
    "prompt": "A task asks what datasets, schemas, and relationships exist in an unfamiliar estate, without naming code behavior.",
    "expected": [
      "classifies the task as data-originated discovery",
      "selects domain-context-pack",
      "uses authorized context progressively",
      "records excluded broad context"
    ],
    "forbidden": [
      "inspects unrelated code",
      "loads the full catalog",
      "claims metadata proves current runtime state"
    ],
    "judge_notes": "Pass only if asset discovery does not inherit the code-originated path."
  },
  {
    "id": "cm-output-003",
    "prompt": "A task asks for a reliable Silver model using requirements, existing code, DataHub, and live data.",
    "expected": [
      "classifies the task as modeling-decision-originated",
      "selects domain-context-pack before broad metadata or live-data inspection",
      "requires Gold Consumer and Modeling Question contracts",
      "uses system-mental-model only for a named implemented-semantics gap",
      "expects a candidate partial unknown or blocked result for human review"
    ],
    "forbidden": [
      "routes through code inspection merely because code exists",
      "starts from Bronze shape without the Gold consumer",
      "automatically creates or approves a Silver table",
      "implements dashboard interaction-driven analytics"
    ],
    "judge_notes": "Pass only if the modeling decision has its own route and retains candidate-only authority."
  }
]
